{"$schema":"https://json-schema.org/draft/2020-12/schema","$id":"urn:aduc:schema:mapping-profile:0.1","title":"ADUC Semantic Mapping Profile 0.1","description":"Candidate machine-readable schema for portable semantic mapping assertions.","type":"object","required":["@context","id","conformsTo","describes","validFor","referenceScheme","issuedAt","assertions"],"properties":{"@context":{"type":"string","format":"uri"},"id":{"type":"string","format":"uri"},"conformsTo":{"const":"urn:aduc:profile:0.1"},"describes":{"type":"string","format":"uri"},"validFor":{"$ref":"#/$defs/sourceBinding"},"referenceScheme":{"type":"string","enum":["croissant-field-id","json-pointer","csv-header"]},"issuedAt":{"type":"string","format":"date-time"},"assertions":{"type":"array","minItems":1,"items":{"$ref":"#/$defs/mappingAssertion"}}},"additionalProperties":false,"$defs":{"sourceBinding":{"type":"object","required":["source"],"properties":{"source":{"type":"string","format":"uri"},"version":{"type":"string","minLength":1},"digest":{"type":"string","pattern":"^sha256:[0-9a-fA-F]{64}$"}},"anyOf":[{"required":["version"]},{"required":["digest"]}],"additionalProperties":false},"mappingAssertion":{"type":"object","required":["id","localReference","semanticTarget","mappingRelation","status","assertedBy","assertedAt"],"properties":{"id":{"type":"string","format":"uri"},"localReference":{"type":"string","minLength":1},"semanticTarget":{"type":"string","format":"uri"},"mappingRelation":{"type":"string","enum":["http://www.w3.org/2004/02/skos/core#exactMatch","http://www.w3.org/2004/02/skos/core#closeMatch","http://www.w3.org/2004/02/skos/core#broadMatch","http://www.w3.org/2004/02/skos/core#narrowMatch","http://www.w3.org/2004/02/skos/core#relatedMatch"]},"status":{"type":"string","enum":["inferred","reviewed","canonical","contested"]},"confidence":{"type":"number","minimum":0,"maximum":1},"confidenceMethod":{"type":"string","format":"uri"},"assertedBy":{"type":"string","format":"uri"},"assertedAt":{"type":"string","format":"date-time"},"evidence":{"type":"array","minItems":1,"uniqueItems":true,"items":{"type":"string","format":"uri"}},"supersedes":{"type":"string","format":"uri"},"note":{"type":"string","minLength":1}},"allOf":[{"if":{"properties":{"status":{"const":"inferred"}},"required":["status"]},"then":{"required":["confidence","confidenceMethod","evidence"]}},{"if":{"properties":{"status":{"const":"canonical"}},"required":["status"]},"then":{"properties":{"confidence":false,"confidenceMethod":false}}},{"if":{"properties":{"status":{"const":"contested"}},"required":["status"]},"then":{"required":["evidence"]}},{"if":{"required":["confidence"]},"then":{"required":["confidenceMethod"]}},{"if":{"required":["confidenceMethod"]},"then":{"required":["confidence"]}}],"additionalProperties":false}}}
