{
  "@context": "urn:aduc:context:0.1",
  "id": "urn:aduc:profile:motor-reading-12-canonical",
  "conformsTo": "urn:aduc:profile:0.1",
  "describes": "https://factory.example/schema/motor-reading/12",
  "validFor": {
    "source": "https://factory.example/schema/motor-reading",
    "version": "12"
  },
  "referenceScheme": "json-pointer",
  "issuedAt": "2026-07-13T16:00:00Z",
  "assertions": [
    {
      "id": "urn:aduc:assertion:motor-winding-temperature-canonical-1",
      "localReference": "/properties/motor_heat",
      "semanticTarget": "https://example.org/industry/MotorWindingTemperature",
      "mappingRelation": "http://www.w3.org/2004/02/skos/core#exactMatch",
      "status": "canonical",
      "assertedBy": "https://factory.example/id/data-authority",
      "assertedAt": "2026-07-13T15:55:00Z",
      "evidence": [
        "urn:evidence:factory-data-dictionary-12"
      ],
      "supersedes": "urn:aduc:assertion:motor-heat-inferred-1"
    }
  ]
}
