{
  "@context": "urn:aduc:context:0.1",
  "id": "urn:aduc:profile:river-record-1-reviewed",
  "conformsTo": "urn:aduc:profile:0.1",
  "describes": "https://data.example.org/schema/river-record/1",
  "validFor": {
    "source": "https://data.example.org/schema/river-record",
    "version": "1"
  },
  "referenceScheme": "json-pointer",
  "issuedAt": "2026-07-13T15:00:00Z",
  "assertions": [
    {
      "id": "urn:aduc:assertion:river-flow-reviewed-1",
      "localReference": "/properties/flow",
      "semanticTarget": "https://example.org/environment/WaterDischarge",
      "mappingRelation": "http://www.w3.org/2004/02/skos/core#exactMatch",
      "status": "reviewed",
      "assertedBy": "urn:person:hydrology-reviewer-7",
      "assertedAt": "2026-07-13T14:55:00Z",
      "evidence": [
        "urn:evidence:review-record-river-1"
      ],
      "supersedes": "urn:aduc:assertion:river-flow-inferred-1"
    }
  ]
}
